{
  "$schema": "https://marbinner.github.io/luryt/schema/language.schema.json",
  "metadata": {
    "project": "luryt",
    "display_name": "Luryt",
    "language_version": "2",
    "schema_version": 1,
    "generated": true,
    "source": "language/"
  },
  "consonants": "PBMFVTDNQSZLCWXJKGRH",
  "vowels": "IYEAOU",
  "numeric_vowels": "IYEAO",
  "numeral_base": 100,
  "final_consonants": "MTNSLR",
  "consonant_ipa": {
    "P": "/p/",
    "B": "/b/",
    "M": "/m/",
    "F": "/f/",
    "V": "/v/",
    "T": "/t/",
    "D": "/d/",
    "N": "/n/",
    "Q": "/ts/",
    "S": "/s/",
    "Z": "/z/",
    "L": "/l/",
    "C": "/tʃ/",
    "W": "/dʒ/",
    "X": "/ʃ/",
    "J": "/j/",
    "K": "/k/",
    "G": "/g/",
    "R": "/ʀ/",
    "H": "/h/"
  },
  "vowel_ipa": {
    "I": "/i/",
    "Y": "/y/",
    "E": "/e/",
    "A": "/a/",
    "O": "/o/",
    "U": "/u/"
  },
  "head_kinds": {
    "M": [
      "Entity head",
      "descriptive noun: \"an X / X-things\" (class or non-anchored, no particular one)"
    ],
    "T": [
      "Referential head",
      "identifiable noun: \"the X\" (a specific individual or set we can identify)"
    ],
    "N": [
      "Event head",
      "verb: \"to X / X happens\""
    ],
    "S": [
      "Property head",
      "adjective: \"X-like, having X-property\""
    ],
    "L": [
      "Manner head",
      "adverb: \"in an X way, X-ly\""
    ],
    "R": [
      "Relational head",
      "relational NP: \"of X, X's, from X, related-by-X\""
    ]
  },
  "domains": {
    "I": [
      "PERSON",
      "individual humans: body, mind, experience"
    ],
    "Y": [
      "SOCIETY",
      "families, groups, institutions, culture"
    ],
    "E": [
      "LIFE",
      "non-human life: animals, plants, ecosystems"
    ],
    "A": [
      "PHYSICAL",
      "non-living world: matter, space, energy, weather"
    ],
    "O": [
      "ARTEFACT",
      "tools, objects, machines, buildings, infrastructure"
    ],
    "U": [
      "ABSTRACT",
      "ideas, language, math, logic, information"
    ]
  },
  "aspects": {
    "I": [
      "INDIVIDUAL",
      "basic \"things/actors\" in that domain"
    ],
    "Y": [
      "CONFIG",
      "parts, wholes, groups, layouts, structures, systems"
    ],
    "E": [
      "PROCESS",
      "activities, processes, changes, doing"
    ],
    "A": [
      "STATE",
      "relatively stable conditions/qualities"
    ],
    "O": [
      "RELATION",
      "links/roles between things"
    ],
    "U": [
      "QUANTITY",
      "measures, magnitudes, degrees"
    ]
  },
  "particle_series": {
    "P": {
      "PI": [
        "inceptive",
        "just now start to"
      ],
      "PY": [
        "progressive",
        "currently, be -ing"
      ],
      "PE": [
        "resumptive",
        "again, back to doing it"
      ],
      "PA": [
        "continuative",
        "still, keep (on)"
      ],
      "PO": [
        "completive",
        "completely, all the way"
      ],
      "PU": [
        "perfect",
        "already, (has) done/finished"
      ]
    },
    "M": {
      "MI": [
        "minimal",
        "slightly, a bit, barely"
      ],
      "MY": [
        "low",
        "somewhat, rather low"
      ],
      "ME": [
        "neutral",
        "moderately, normally"
      ],
      "MA": [
        "above-typical",
        "quite, pretty, fairly"
      ],
      "MO": [
        "strong",
        "very, strongly"
      ],
      "MU": [
        "maximal",
        "extremely, too, overly"
      ]
    },
    "F": {
      "FI": [
        "additive",
        "and"
      ],
      "FY": [
        "sequential",
        "and then"
      ],
      "FE": [
        "alternative",
        "or (inclusive)"
      ],
      "FA": [
        "adversative",
        "but, yet"
      ],
      "FO": [
        "consecutive",
        "so, therefore"
      ],
      "FU": [
        "preventive",
        "or else, otherwise"
      ]
    },
    "T": {
      "TI": [
        "remote past",
        "long ago"
      ],
      "TY": [
        "recent past",
        "recently, just now"
      ],
      "TE": [
        "present",
        "now, currently"
      ],
      "TA": [
        "near future",
        "soon, about to"
      ],
      "TO": [
        "far future",
        "later, someday"
      ],
      "TU": [
        "gnomic",
        "generally, whenever"
      ]
    },
    "D": {
      "DI": [
        "near singular",
        "this"
      ],
      "DY": [
        "near plural",
        "these"
      ],
      "DE": [
        "medial singular",
        "that (here / in view)"
      ],
      "DA": [
        "medial plural",
        "those (here / in view)"
      ],
      "DO": [
        "far singular",
        "that (elsewhere)"
      ],
      "DU": [
        "far plural",
        "those (elsewhere)"
      ]
    },
    "N": {
      "NI": [
        "affirmation",
        "yes, indeed, it is so"
      ],
      "NY": [
        "partial",
        "sort of, partly, more or less"
      ],
      "NE": [
        "neutral",
        "(no special polarity)"
      ],
      "NA": [
        "negation",
        "not, no, it isn't so"
      ],
      "NO": [
        "contrary",
        "on the contrary, anti-"
      ],
      "NU": [
        "strong negation",
        "never, absolutely not, cannot"
      ]
    },
    "Q": {
      "QI": [
        "empty",
        "no, none of"
      ],
      "QY": [
        "existential",
        "a / some (there exists)"
      ],
      "QE": [
        "partitive",
        "some of (them), not all"
      ],
      "QA": [
        "large subset",
        "most (of)"
      ],
      "QO": [
        "universal collective",
        "all (of), the whole X"
      ],
      "QU": [
        "universal distributive",
        "every / each / any (one by one)"
      ]
    },
    "S": {
      "SI": [
        "interior",
        "in, inside (within X)"
      ],
      "SY": [
        "surface",
        "on, on top of, touching X"
      ],
      "SE": [
        "adjacency",
        "next to, beside X"
      ],
      "SA": [
        "surrounding",
        "around X, in X's area"
      ],
      "SO": [
        "exterior",
        "outside X, beyond X"
      ],
      "SU": [
        "among",
        "among X, amidst, throughout"
      ]
    },
    "C": {
      "CI": [
        "minimal bound",
        "at least"
      ],
      "CY": [
        "less-than",
        "less, not as ~"
      ],
      "CE": [
        "equal",
        "as ~ as, equally"
      ],
      "CA": [
        "more-than",
        "more, -er"
      ],
      "CO": [
        "superlative",
        "most, at most"
      ],
      "CU": [
        "extremal",
        "as ~ as possible"
      ]
    },
    "W": {
      "WI": [
        "time",
        "when?"
      ],
      "WY": [
        "reason",
        "why? (for what reason?)"
      ],
      "WE": [
        "place",
        "where?"
      ],
      "WA": [
        "thing",
        "what? / what thing?"
      ],
      "WO": [
        "person",
        "who? / which person?"
      ],
      "WU": [
        "manner",
        "how? / in what way?"
      ]
    },
    "J": {
      "JI": [
        "1sg",
        "I"
      ],
      "JY": [
        "1pl",
        "we"
      ],
      "JE": [
        "2sg",
        "you (sg)"
      ],
      "JA": [
        "2pl",
        "you (pl)"
      ],
      "JO": [
        "3sg",
        "he / she / it"
      ],
      "JU": [
        "3pl",
        "they"
      ]
    },
    "K": {
      "KI": [
        "singled",
        "as a single unit, alone, singly"
      ],
      "KY": [
        "pair",
        "in pairs, as a pair"
      ],
      "KE": [
        "small group",
        "in a small group, a few together"
      ],
      "KA": [
        "generic group",
        "as a group, together, in a crowd"
      ],
      "KO": [
        "large collective",
        "en masse, as a large crowd/mass"
      ],
      "KU": [
        "scattered",
        "scattered, spread out, all over"
      ]
    },
    "G": {
      "GI": [
        "origin",
        "from, starting at (the path's origin)"
      ],
      "GY": [
        "departure",
        "away from, leaving"
      ],
      "GE": [
        "route",
        "along, via, through"
      ],
      "GA": [
        "approach",
        "toward, nearing"
      ],
      "GO": [
        "endpoint",
        "into / onto, arriving at, reaching"
      ],
      "GU": [
        "return",
        "back to, returning"
      ]
    },
    "R": {
      "RI": [
        "agent",
        "by (agent), as doer"
      ],
      "RY": [
        "experiencer",
        "to / for (person)"
      ],
      "RE": [
        "patient",
        "object of, about; \"than\" in comparatives"
      ],
      "RA": [
        "instrument",
        "with, using, by means of"
      ],
      "RO": [
        "location",
        "at, in, on (place/time)"
      ],
      "RU": [
        "path-frame closer",
        "closes a G-oriented path phrase; orientation comes from the G-series"
      ]
    },
    "H": {
      "HI": [
        "single",
        "once, one time"
      ],
      "HY": [
        "low frequency",
        "rarely, seldom"
      ],
      "HE": [
        "intermittent",
        "sometimes"
      ],
      "HA": [
        "frequent",
        "often, frequently"
      ],
      "HO": [
        "habitual",
        "usually, normally"
      ],
      "HU": [
        "maximal frequency",
        "always, constantly"
      ]
    }
  },
  "particle_series_metadata": {
    "P": {
      "name": "Phase"
    },
    "M": {
      "name": "Degree"
    },
    "F": {
      "name": "Coordination"
    },
    "T": {
      "name": "Time"
    },
    "D": {
      "name": "Demonstratives"
    },
    "N": {
      "name": "Polarity"
    },
    "Q": {
      "name": "Quantifiers"
    },
    "S": {
      "name": "Space"
    },
    "C": {
      "name": "Comparison"
    },
    "W": {
      "name": "Question words"
    },
    "J": {
      "name": "Pronouns"
    },
    "K": {
      "name": "Grouping"
    },